{"$schema":"https://json-schema.org/draft/2020-12/schema","type":"object","additionalProperties":false,"properties":{"schema":{"const":"sm86_c7_sol_fibp010_source_v1"},"status":{"type":"string"},"phase":{"const":"C7-S34CL1"},"candidate":{"type":"string"},"environment":{"type":"object","additionalProperties":true},"source_contract":{"type":"object","additionalProperties":true},"selection_basis":{"type":"string","minLength":1}},"required":["schema","status","phase","candidate","environment","source_contract","selection_basis"],"title":"SM86 C7-S34CL1 FIB problem010 CUTLASS source review"}
