{
  "candidate": "FIB/problem_010_gemm_n6144_k4096/cutlass",
  "environment": {
    "cuda_available": true,
    "torch": "2.12.0+cu130",
    "torch_cuda_runtime": "13.0",
    "gpu": "NVIDIA GeForce RTX 3090 Ti",
    "capability": "8.6",
    "permitted_environment": "tools/sol_execbench/.venv",
    "host_compiler": "/usr/bin/g++-14",
    "nvcc_expected": "CUDA 13.2",
    "cutlass_include": "third_party/cutlass/include"
  },
  "phase": "C7-S34CL1",
  "schema": "sm86_c7_sol_fibp010_source_v1",
  "source_contract": {
    "source": "workloads/sol_execbench_baselines/FIB/problem_010_gemm_n6144_k4096/cutlass",
    "entry_point": "main.cpp::run",
    "class": "cutlass_cuda",
    "sm86_marker": true,
    "packaged_target": "-gencode arch=compute_86,code=sm_86",
    "custom_kernels": [],
    "vendor_kernel": "CUTLASS device::Gemm TensorOp",
    "cutlass_arch_tag": "cutlass::arch::Sm80 (TensorOp; valid for SM86 target)",
    "constants": {
      "N": 6144,
      "K": 4096,
      "dtype": "FP16 inputs/output with FP32 accumulator",
      "threadblock": [
        128,
        128,
        32
      ],
      "warp": [
        64,
        64,
        32
      ],
      "instruction": [
        16,
        8,
        16
      ],
      "stages": 3
    },
    "inputs": "FP16 A [M,4096] and B [6144,4096]",
    "outputs": "FP16 destination C [M,6144]",
    "math": "C = A @ B.T",
    "oracle": "independent FlashInfer-Bench/010_gemm_n6144_k4096/reference.py torch.matmul",
    "workload_rows": 43,
    "declared_M": [
      256,
      248,
      240,
      232,
      224,
      216,
      208,
      200,
      192,
      184,
      176,
      168,
      160,
      152,
      144,
      136,
      128,
      120,
      112,
      104,
      96,
      88,
      80,
      72,
      64,
      56,
      48,
      40,
      32,
      24,
      16,
      8,
      4,
      2,
      1,
      7,
      35,
      972,
      70,
      2053,
      8192,
      2379,
      15
    ]
  },
  "selection_basis": "Next unexecuted CUTLASS row after FIB/problem009 L1-L2 vertical; no timing or NCU values transferred",
  "status": "complete_source_contract_and_sm86_environment_review"
}
